{"$schema":"https://json-schema.org/draft/2020-12/schema","$id":"https://3d-master-2005.local/recipe/v1/provider","type":"object","additionalProperties":false,"properties":{"version":{"type":"integer","const":1},"name":{"type":"string","minLength":1},"objects":{"type":"array","items":{"$ref":"#/$defs/object"}},"materials":{"type":"array","items":{"$ref":"#/$defs/material"}},"actions":{"type":"array","items":{"$ref":"#/$defs/action"}},"exports":{"type":"array","items":{"$ref":"#/$defs/export"}}},"$defs":{"object":{"type":"object","additionalProperties":false,"required":["name"],"properties":{"name":{"type":"string","minLength":1},"primitive":{"type":["string","null"],"enum":["sphere","box","cylinder","cone","torus","plane","lathe","extrude",null]},"params":{"type":"object"},"splines":{"type":"array","items":{"$ref":"#/$defs/spline"}},"bones":{"type":"array","items":{"$ref":"#/$defs/bone"}},"transform":{"oneOf":[{"type":"array","minItems":3,"maxItems":3,"items":{"type":"number"}},{"type":"array","minItems":16,"maxItems":16,"items":{"type":"number"}},{"type":"array","minItems":4,"maxItems":4,"items":{"type":"array","minItems":4,"maxItems":4,"items":{"type":"number"}}},{"type":"object","additionalProperties":false,"properties":{"translate":{"$ref":"#/$defs/vec3"},"rotate_deg":{"$ref":"#/$defs/vec3"},"scale":{"$ref":"#/$defs/vec3"}}}]}}},"spline":{"type":"object","additionalProperties":false,"required":["points"],"properties":{"points":{"type":"array","items":{"type":"array","minItems":3,"maxItems":3,"items":{"type":"number"}}},"name":{"type":"string"},"degree":{"type":"integer","minimum":1},"closed":{"type":"boolean"}}},"bone":{"type":"object","additionalProperties":false,"required":["name","head","tail"],"properties":{"name":{"type":"string","minLength":1},"head":{"$ref":"#/$defs/vec3"},"tail":{"$ref":"#/$defs/vec3"},"parent":{"type":["string","null"]},"weights":{"type":"object","propertyNames":{"pattern":"^[0-9]+$"},"additionalProperties":{"type":"number","minimum":0.0}},"cp_weights":{"type":"object","propertyNames":{"pattern":"^[0-9]+$"},"additionalProperties":{"type":"number","minimum":0.0}}}},"material":{"type":"object","additionalProperties":false,"required":["name"],"properties":{"name":{"type":"string","minLength":1},"color":{"$ref":"#/$defs/color"},"roughness":{"type":"number","minimum":0,"maximum":1},"metalness":{"type":"number","minimum":0,"maximum":1},"texture":{"type":["string","null"]},"pattern":{"type":["string","null"],"enum":["solid","checker","gradient","noise","bricks",null]},"params":{"type":"object"},"graph":{"type":"array","items":{"$ref":"#/$defs/graphNode"}},"objects":{"type":"array","items":{"type":"string"}}}},"action":{"type":"object","additionalProperties":false,"required":["name"],"properties":{"name":{"type":"string","minLength":1},"kind":{"enum":["walk","idle","jump","custom","retarget"]},"duration":{"type":"number","exclusiveMinimum":0},"character":{"type":["string","null"]},"channels":{"type":"array","items":{"$ref":"#/$defs/channel"}},"params":{"type":"object"},"source_action":{"type":["string","null"]}}},"graphNode":{"type":"object","additionalProperties":false,"properties":{"type":{"enum":["solid","checker","gradient","noise","bricks","noise_overlay","tint"]},"params":{"type":"object"}}},"channel":{"type":"object","additionalProperties":false,"required":["bone"],"properties":{"bone":{"type":"string","minLength":1},"property":{"enum":["translate","rotate","scale","weight"]},"keys":{"type":"array","items":{"$ref":"#/$defs/key"}}}},"key":{"type":"object","additionalProperties":false,"required":["time","value"],"properties":{"time":{"type":"number"},"value":{"type":"array","items":{"type":"number"}},"interp":{"enum":["linear","step","smooth"]}}},"export":{"type":"object","additionalProperties":false,"required":["format","path"],"properties":{"format":{"enum":["obj","glb","gltf","spritesheet","toon_sheet","am3d","animation_sheet"]},"path":{"type":"string","minLength":1},"params":{"type":"object"}}},"vec3":{"type":"array","minItems":3,"maxItems":3,"items":{"type":"number"}},"color":{"type":"array","minItems":3,"maxItems":4,"items":{"type":"number","minimum":0,"maximum":1}}}}
