{
  "version": 1,
  "name": "knight",
  "objects": [
    {
      "name": "body",
      "primitive": "sphere",
      "params": {
        "radius": 0.6,
        "sections": 16,
        "rings": 8
      }
    },
    {
      "name": "hero",
      "bones": [
        {
          "name": "hip",
          "head": [
            0.0,
            0.9,
            0.0
          ],
          "tail": [
            0.0,
            1.0,
            0.0
          ]
        },
        {
          "name": "spine",
          "head": [
            0.0,
            1.0,
            0.0
          ],
          "tail": [
            0.0,
            1.4,
            0.0
          ],
          "parent": "hip"
        },
        {
          "name": "leg_l",
          "head": [
            -0.12,
            0.9,
            0.0
          ],
          "tail": [
            -0.12,
            0.45,
            0.0
          ],
          "parent": "hip"
        },
        {
          "name": "leg_r",
          "head": [
            0.12,
            0.9,
            0.0
          ],
          "tail": [
            0.12,
            0.45,
            0.0
          ],
          "parent": "hip"
        }
      ]
    }
  ],
  "materials": [
    {
      "name": "iron",
      "color": [
        0.65,
        0.7,
        0.8
      ],
      "roughness": 0.35,
      "metalness": 0.85,
      "objects": [
        "body"
      ]
    }
  ],
  "actions": [
    {
      "name": "walk",
      "kind": "walk",
      "duration": 1.2,
      "character": "hero"
    }
  ],
  "exports": [
    {
      "format": "obj",
      "path": "knight_mesh"
    },
    {
      "format": "glb",
      "path": "knight_asset"
    },
    {
      "format": "spritesheet",
      "path": "knight_sheet",
      "params": {
        "views": 8,
        "size": 128
      }
    },
    {
      "format": "am3d",
      "path": "knight_project"
    }
  ]
}